_id,sentence,target,aspect,score,type
940033,"Considering their price of $6.25 for lunch special, the dish was ridiculously small.",price,price,-1,headline
725726,This is the pinnacle of Indian Fast Food (all fast foods in my opinion).,Indian Fast Food,Indian Fast Food,1,headline
520444,"Besides, when you have bad service, that's less money you have to tip.",service,service,-1,headline
761369,The wine list is also really nice.,wine list,wine list,1,headline
454055,"Service was devine, oysters where a sensual as they come, and the price can't be beat!!!",Service,Service,1,headline
349586,"Compared to Ess-a, Tal offers a less doughy bagel!",bagel,bagel,-1,headline
445002,Ballato's is consistently delicious authentic italian food.,italian food,italian food,1,headline
930271,"The service was attentive, yet discreet.",service,service,1,headline
528204,For those prices and the dressed up atmosphere you expect more and should get more.,prices,prices,-1,headline
712034,They offer the same menu but have creative drinks that are loaded with alcohol and cheeky names -- but they do cost you.,menu,menu,1,headline
363556,We went to eat at the Jekyll and Hyde restaurant on Friday night and really enjoyed the fun atmosphere and good food.,atmosphere,atmosphere,1,headline
722213,The food was pretty tradional but it was hot and good with large portions.,food,food,1,headline
429541,"Unless you are eating in the Pizzeria side of this place, and are not in a rush, this place is a bad idea.",place,place,-1,headline
340357,You have to increase the service a lot.,service,service,-1,headline
753330,Ambiance is barely romantic but management tries.,Ambiance,Ambiance,1,headline
164729,"I must warn the reader that the portions sizes are very small (especially the appetizers), so if you plan to eat until you are full and do not intend to order the chef's special tasting menu, prepare to order and pay for an appetizer (1 dish for each person because the portions are not for sharing), a main entree, and the cold udon at the end of the meal.",portions,portions,1,headline
543627,"After we got our sashimi order, I could not believe how small the portions were!",sashimi,sashimi,0,headline
603780,"After the main course came, we didn't see our waiter for at least 40 MINUTES!",main course,main course,0,headline
973501,Nothing better than buying a snapple for $3.25 too.,snapple,snapple,1,headline
130414,"When family came in he gave them apps to test their palets, and then ordered for them.",apps,apps,0,headline
235306,"Service is extraordinary, yet not overbearing, and the decor brings a taste of trendy SoHo into Queens.",Service,Service,1,headline
582777,If I wanted to deal with a crappy scene and annoying customers I'd go out in Manhattan.,scene,scene,-1,headline
977194,"After a seafood craving, i checked citysearch and chose to go to Fish based on a previous review and the citysearch info.",seafood,seafood,0,headline
924059,Until you realize that their five minutes is meaningless and your wait may be anywhere from two to twenty minutes it may be frustrating.,wait,wait,-1,headline
930292,"Thalia is a beautiful restaurant with beautiful people serving you, but the food doesn't quite match up.",people serving,people serving,1,headline
706593,The fillings may be unconventional but the dosa batter is definitely authentic and the combinations very tasty.,fillings,fillings,1,headline
507258,"This is the perfect spot for meeting friends, having lunch, dinner, pre-theatre or after-theatre drinks!",spot,spot,1,headline
758446,"The mussaman curry that I ordered was as thin as water and aside from the poorly fried tofu that I ordered in it, they graciously provided me with ONE piece of poorly cooked potato.",mussaman curry,mussaman curry,-1,headline
350359,Had a late night dinner on a Saturday night.,dinner,dinner,0,headline
576241,A restaurant that doesn't try to do anything except serve great food with great service in a pleasant atmosphere.,food,food,1,headline
135270,Their sake martini is wonderful.,sake martini,sake martini,1,headline
460839,"Well, this place is so Ghetto its not even funny.",place,place,-1,headline
881266,Once they ran out of Gnochi and made it for me from scratch!,Gnochi,Gnochi,0,headline
717532,We would like to thank Marcelo and Grace for a wonderful dining experience!!!,dining,dining,1,headline
949437,"Found service above average, but that could be because we were 13 of us.",service,service,1,headline
105039,"Bagels are ok, but be sure not to make any special requests!",Bagels,Bagels,0,headline
507654,fine dining restaurant quality.,quality,quality,1,headline
779034,Overall a disappointing experience for that price category.,price,price,-1,headline
916836,"I've had the lunch buffet at Chennai a couple of times, when I have been in the neighborhood.",lunch buffet,lunch buffet,0,headline
325558,The food was exceptional.,food,food,1,headline
818180,A Thai restaurant out of rice during dinner?,rice,rice,0,headline
624096,The portions are small but being that the food was so good makes up for that.,portions,portions,1,headline
123872,(and I have eaten my share) Which impresses me for having such a large amount of people to serve.,serve,serve,1,headline
437525,"Sure, the setting is nice.",setting,setting,1,headline
360636,"The service is friendly, if not the most prompt in the world, the food is great, and the prices, while not cheap, won't put your wallet out of commission.",service,service,1,headline
906687,"Had 1 appetizer, 2 entrees and 2 cokes and the bill was ~$55.00, not including tip.",appetizer,appetizer,0,headline
231816,Best drumsticks over rice and sour spicy soup in town!,drumsticks over rice,drumsticks over rice,1,headline
403828,Slightly above average wines start at $70+ with only one selection listed at $30+.,wines,wines,-1,headline
736385,Their whitefish salad is excellent--all whitefish with a little mayo.,whitefish salad,whitefish salad,1,headline
945241,"The chicken parm was edible but had canned tomato sauce and boxed pasta and the chicken with portobello mushrooms consisted of dry, inedible chicken with terrible sauce.",chicken,chicken,-1,headline
778004,I recommend this place to everyone who asks me where to go for a good meal.,meal,meal,1,headline
811758,The waitresses are nice--also you can just get counter service sit.,waitresses,waitresses,1,headline
909879,The only friendly staff member was the guy at the bar.,staff member,staff member,1,headline
929941,"You can certainly find restaurants that offer a superior fine dining experience, but for superb food at reasonable prices, La Villa can't be beat.",food,food,1,headline
393727,Won't or Can't is not in the service directory.,service,service,1,headline
993150,I cannot imagine a friendlier staff working in a restaurant.,staff,staff,1,headline
588927,I do suggest to ask to be seated upstairs if you are looking to be a little cozy.,upstairs,upstairs,1,headline
243784,"The red curry is weak and tasteless, the pad thai is stuck together and lumpy, the rice is often overcooked, and the seafood is pretty sketchy.",red curry,red curry,-1,headline
830325,The wine list is extensive and can easily hike up an otherwise reasonably priced meal.,wine list,wine list,1,headline
216319,"Saul is pretty good, but definitely not great.",Saul,Saul,0,headline
658238,We always get a sampling of appetizers and share.,appetizers,appetizers,0,headline
428641,"Overall I was impressed and will return, it's a great QPR (Quality to Price Ratio).",Quality,Quality,1,headline
887381,"It is nearly impossible to get a table, so if you ever have the chance to go here for dinner, DO NOT pass it up.",table,table,1,headline
138389,Their pad penang is delicious and everything else is fantastic.,pad penang,pad penang,1,headline
244423,"The puke green walls leave a lot to be desired, but the food is very good.",walls,walls,1,headline
655540,"The flavors are very fresh and pretty inobtrusive, nothing flashy.",flavors,flavors,1,headline
480969,"I like Cafe Noir dont get me wrong, it is jsut that the people who work there are evil and incompetent!!",people,people,-1,headline
862804,The hanger steak was like rubber and the tuna was flavorless not to mention it tasted like it had just been thawed.,hanger steak,hanger steak,-1,headline
763218,big and soft as well as good lunch food.,lunch food,lunch food,1,headline
367510,"No food snobs allowed, this place is for people who appreciate good food.",food,food,0,headline
948054,I liked the food at this quasi-thai restaurant.,food,food,1,headline
409104,By far the best salad I have had in a fast food restaurant.,salad,salad,1,headline
440831,"As for the bar, this is another bad idea.",bar,bar,-1,headline
561214,"Their bagels are fine, but they are a little overcooked, and not really a 'special' bagel experience.",bagel,bagel,0,headline
645840,"Unlike HH up the block, this place actually gives you hearty and hot bagels this town is known for.",bagels,bagels,1,headline
642720,The barebecued salmon is elegantly spiced and not at all dry.,barebecued salmon,barebecued salmon,1,headline
475158,"Same owner as the guy who owns Typhoon, which is just down the street on St. Marks and 1st Ave.",owner,owner,0,headline
304203,What generous portions!,portions,portions,1,headline
809898,The workers there also absolutely load the bagel with cream cheese (gets a little messy).,workers,workers,0,headline
155462,The wine the service was very good too.,wine,wine,1,headline
805050,The highly spiced chai tea was great too.,chai tea,chai tea,1,headline
312933,"I have been there many times, and food is good and consistent.",food,food,1,headline
242069,"Seriously, this is the best all you can eat in town- As everyone says, the Spicy Tuna hand rolls are the best- have 4 of these, and you've broken even.",Spicy Tuna hand rolls,Spicy Tuna hand rolls,1,headline
382575,"While Sapphire is certainly not lacking in ambiance, and probably has the best decor of any Indian restaurant I have been to in New York City, the food was not what I had hoped for.",ambiance,ambiance,1,headline
130317,I would highly recommend this place to anyone looking for a casual atmosphere that whisks you away to the left bank of the river Seine.,atmosphere,atmosphere,1,headline
323492,The meat dishes were only so-so.,meat dishes,meat dishes,0,headline
531577,"His wife Tanya, the hostess, completes the comforting atmosphere by being delightfully warm and gracious.",hostess,hostess,1,headline
776973,"The menu consisted of standard brassiere food, better then places like Balthazar etc.",menu,menu,1,headline
116339,"I have been a longtime fan of Holy Basil in the East Village, and while I do believe their food has slightly slipped in quality, I have been hesitant to be disloyal.",food,food,-1,headline
713756,"But the best part about LS is the late night atmosphere, delightfully free of the BTs.",atmosphere,atmosphere,1,headline
194177,We even had a visit from the Manager who wanted to make sure we were enjoying ourselves.,Manager,Manager,1,headline
785590,The staff there is very attentive and down to earth.,staff,staff,1,headline
862934,"You don't go to Mizu for excellent service, you go for the large amounts of food, the amiable atmosphere, and the hole-in-the-wall feeling of the place.",service,service,1,headline
585575,"The service is always bad though, don't expect much of anything from your server, and I would not recommend bringing a date here either.",service,service,-1,headline
125705,Monday nights are a bargain at the $28 prix fix - this includes a three course meal plus *three* glasses of wine paired with each course.,prix fix,prix fix,1,headline
344173,It took them 15 minutes to put water in our glasses.,water,water,0,headline
104520,The service is descent even when this small place is packed.,service,service,1,headline
454820,I have eaten a lot of pizza here.,pizza,pizza,0,headline
492513,Great value for the quality ingredients.,ingredients,ingredients,1,headline
279857,"The Thali was small, thoroughly unremarkable, and $14.95.",Thali,Thali,-1,headline
882920,The sushi is also great!,sushi,sushi,1,headline
342062,From the complimentary chef app of a delicate butternut squash ravioli in a delicious truffle sauce to an amazing buttery and tender langostine entree to a dessert that I can't remember because of the fabulous Cakebread Cabernet we were drinking -- the whole evening was amazing.,chef app,chef app,1,headline
159273,Truly the mark of an attentive waiter.,waiter,waiter,1,headline
387956,"The food here is rather good, but only if you like to wait for it.",food,food,1,headline
999914,I got an excellent piece of cheesecake and we had several other nice pastries.,cheesecake,cheesecake,1,headline
887114,"The staff is very kind and well trained, they're fast, they are always prompt to jump behind the bar and fix drinks, they know details of every item in the menu and make excelent recomendations.",staff,staff,1,headline
817097,The makhani was OK --the korma was bland.,makhani,makhani,0,headline
523974,The food is inventive but still keeps traditional indian flavoring.,food,food,1,headline
672675,"The decor in this place is very diner-ish and the kind of place you expect in the East Village - not romantic, just simple, small and sparse.",decor,decor,1,headline
746746,This is a cute place and could be good but they need to get their act together.,place,place,1,headline
568347,The lox is always fresh too.,lox,lox,1,headline
423627,Service was very friendly.,Service,Service,1,headline
369389,So all I'm trying to say is this restaurant is by far the best thai food restaurant I've ever been to.,thai food,thai food,1,headline
596176,We actually left hungry and went across the street to Wo Hop at 15 Mott street for some good chinese food.,chinese food,chinese food,1,headline
324034,The duck confit is always amazing and the foie gras terrine with figs was out of this world.,duck confit,duck confit,1,headline
632361,"The whole set up is truly unprofessional and I wish Cafe Noir would get some good staff, because despite the current one this is a great place.",staff,staff,-1,headline
112849,The staff offers impeccable service.,staff,staff,1,headline
728102,We ended our great experience by having Gulab Jamun (dessert) recommended by the waiter.,Gulab Jamun (dessert),Gulab Jamun (dessert),1,headline
270875,"This place doesn't compare with Mamoun's in terms of price, freshness, value, and consisent quality, but that's just my opinion.",price,price,-1,headline
193380,"The place is sleek, modern and playfull and i will return again frequently.",place,place,1,headline
491275,"I have known about this secret for the last 13 years, Emilio(the Godfather) has continued to serve food and wine for the gods at mortal prices.",food,food,1,headline
930254,"After being told that our party of three would be seated in 10 minutes and watching other parties (multiples of 2 and higher) seated for 40 minutes, the three of us were squished into a small 2-person table.",2-person table,2-person table,-1,headline
247711,And the bill was outragous.,bill,bill,-1,headline
226630,"The service was attentive, yet unimposing, the food was far better than many notorious restaurants in Midtown and the wine list is extensive and well priced.",food,food,1,headline
925963,"Kind, attentive wait staff.",wait staff,wait staff,1,headline
588572,Salads were fantastic.,Salads,Salads,1,headline
777357,The owners and employees are friendly and their pizza is fantastic.,owners,owners,1,headline
839527,"The food is yummy, especially their cooked-to-perfection mussels in spicy tomato sauce and their shoestring crispy fries.",food,food,1,headline
751119,The food is authentic Italian - delicious!,food,food,1,headline
696810,skip dessert.,dessert,dessert,-1,headline
414929,I complete the total bagel experience by having it lightly toasted.,bagel,bagel,1,headline
592281,It was like the servers forgot that they actually worked there and instead wanted to hang out and be cool.,servers,servers,-1,headline
543538,The service is good and ambience is good for a date or group outing.,service,service,1,headline
850623,A great way to make some money is to buy a case of snapple from Costco and sell it right outside for only $2.50.,case of snapple,case of snapple,0,headline
569930,Fast service.,service,service,1,headline
299992,"The staff is excellent, specjal: that girl behind the bar, european chic.",staff,staff,1,headline
359562,"stick with the chicken, beef, and lamb dishes.",chicken,chicken,1,headline
160615,"We a menu that rearely changes,e xcept for one or two specials, the quality and care they put in thier food in evident.",specials,specials,1,headline
737876,This restaurant is a wonderful place to go many times and it is reasonably priced.,priced,priced,1,headline
895355,"Bottom line: B+ for the food, F for the service.",food,food,1,headline
462014,The only thing the waiters don't do for you is wipe your chin when you leave.,waiters,waiters,1,headline
322578,"Stick to dimsum, not super overpriced noodles.",dimsum,dimsum,1,headline
652827,The service is fine and they allow you to enjoy the view.,service,service,1,headline
263055,"We, there were four of us, arrived at noon - the place was empty - and the staff acted like we were imposing on them and they were very rude.",staff,staff,-1,headline
181487,delicious simple food in nice outdoor atmosphere.,food,food,1,headline
368363,The only fallback on this restaurant is the prices.,prices,prices,-1,headline
522756,I've been to Naples 45 for dinner twice.,dinner,dinner,0,headline
853791,The hot and sour soup was unbearably hot and tasted of only pepper and nothing else.,soup,soup,-1,headline
725669,Try sushimi cucumber roll.,sushimi cucumber roll,sushimi cucumber roll,1,headline
724751,The food is delicious.,food,food,1,headline
663332,Their wines by the glass are a great accompaniment and you can eat like a king with wine for under $30.,wines by the glass,wines by the glass,1,headline
287256,This place has the the correct ambience and an excellent staff to make you feel like a guest and a friend at the same time.,place,place,1,headline
453731,Yeah Shanghai is also great but not quite as good -- they use the same amount of salt but without sweetness to balance out.,salt,salt,-1,headline
310877,"believe us, we've been eating sushi for over 15 yrs.",sushi,sushi,0,headline
997546,The atmosphere is much better than Sripraphai (more modern and sleek).,atmosphere,atmosphere,1,headline
848904,"The food is outstanding and the service is quick, friendly and very professional.",food,food,1,headline
538326,"The bagels always warm, soft on the inside, crispy on the outside and enormous in size.",bagels,bagels,1,headline
397707,"I had a late dinner at Lucky Stike, a great name for a joint if ever I saw one.",dinner,dinner,0,headline
359974,Service is fast and friendly.,Service,Service,1,headline
672526,from an English speaking staff.,staff,staff,0,headline
314181,And they have these home made potato chips at the bar that are the most delicious things in the world!,potato chips,potato chips,1,headline
547127,"I went here with a friend on a whim, we went someplace else first and couldn't get a table.",table,table,-1,headline
111527,"We all ate pasta entre'es, which were great.",pasta entre'es,pasta entre'es,1,headline
515607,The steak was excellent and one of the best I have had (I tasted the butter intitally but in no way did it overwhelm the flavor of the meat).,steak,steak,1,headline
340095,The food was boring and expensive.,food,food,-1,headline
826523,"The ambience is pretty and nice for conversation, so a casual lunch here would probably be best.",ambience,ambience,1,headline
844535,Terrific menu full of unique rolls and special dishes.,menu,menu,1,headline
543709,The service is ok but could be better.,service,service,-1,headline
723126,"We love the food, drinks, and atmosphere!",food,food,1,headline
355551,I was here a few weeks back and we had the worst customer service experience at a restaurant ever.,customer service,customer service,-1,headline
326294,"Went on a 3 day oyster binge, with Fish bringing up the closing, and I am so glad this was the place it O trip ended, because it was so great!",oyster,oyster,1,headline
948155,"Took my mom for Mother's Day, and the maitre d' was pretty rude.",maitre d',maitre d',-1,headline
941200,My husband and I have been there a couple of times and each time we sat at the sushi bar (chef Yoshi) and ordered everything ala carte.,sushi bar chef,sushi bar chef,0,headline
949923,"The vibe is very relaxed and cozy, service was great and the food was excellent!",vibe,vibe,1,headline
199784,"If the weather is nice, try to snag an outside table.",table,table,1,headline
503862,"If you are looking for a good quality, cheap eats - this is the place.",quality,quality,1,headline
690125,The service was friendly and the atmosphere was casual.,service,service,1,headline
390445,When I lived upstate for a while I would buy freeze the bagels and they would still be better than any else.,bagels,bagels,0,headline
201992,"I recommend their Pad See Ew, Pork Chops or Tofu plates.",Pad See Ew,Pad See Ew,1,headline
524417,Never in my life did I think that I could be satisfied both in taste and in quantity for $3.00 in NYC.,taste,taste,1,headline
732769,"this is the best secret place in midtown', I heard that from the bartender, after having brilliant food ( try steak with portobello mushrooms) and drinks on the bar last Tuesday.",bartender,bartender,1,headline
806902,The service was excellent - friendly and attentive.,service,service,1,headline
115058,"The main course had an average portion, and was decent overall.",main course,main course,1,headline
219185,20 minutes for our reservation but it gave us time to have a few cocktails and enjoy our surroundings and each other.,reservation,reservation,1,headline
685094,"Waitstaff is great, very attentive.",Waitstaff,Waitstaff,1,headline
242628,The dinner menu is diverse and top-notch as well.,dinner menu,dinner menu,1,headline
988059,IT IS WHAT MODERN CUISINE IS ALL ABOUT.,CUISINE,CUISINE,1,headline
862253,"I don't like Indian food too much and this was delicious, however you want to factor that into the equation.",Indian food,Indian food,1,headline
513983,"at taj, vegetarians can rejoice-all the dishes are manna from heaven.",dishes,dishes,1,headline
366499,I won't go back unless someone else is footing the bill.,bill,bill,-1,headline
435692,"We live in New Jersey and whenever we go into New York City we buy bagels to eat hot and then to freeze (they told me that if I call in the order, they'd bring it out to the car so I wouldn't have to look for parking).",bagels,bagels,0,headline
529639,Jimmy's is hands down the hottest night spot in the Bronx.,spot,spot,1,headline
910594,And I would have to agree with the masses in terms of service - delivery is their Achilles' heel.,service,service,-1,headline
579914,"The $300 bill was a bit steep, but the experience was great.",bill,bill,-1,headline
160177,"Nice ambiance, nice little bar, good bartender, Francois, and good service.",ambiance,ambiance,1,headline
379566,"The calamari comes with an incredible sauce, and the duck noodles are yummy as well.",calamari,calamari,1,headline
794837,Simple comfort food and what hot and lage portions.,comfort food,comfort food,1,headline
894178,"Stay away from the two specialty rolls on the menu, though- too much avocado and rice will fill you up right quick.",rolls,rolls,0,headline
964948,We didn't get drink refills and she didn't even offer us the option of dessert.,drink refills,drink refills,0,headline
546343,The bagels are also reasonably priced for NYC.,bagels,bagels,1,headline
297092,"If you can handle that, it's a great place for a business dinner, fun with friends or simply a table for 2.",business dinner,business dinner,1,headline
713291,Decor leaves something to be desired.,Decor,Decor,-1,headline
195267,"Also, specify if you like your food spicy- its rather bland if you don't.",food,food,0,headline
710059,"Our waiter was fine, the place looks nice in that not-trying-too-hard way, but at those prices, a little more should be expected of your food.",waiter,waiter,1,headline
654570,Coming from Boston this place is like Emma's Pizza in Kendall Square in Cambridge (although they have more funky toppings!),toppings,toppings,1,headline
434210,"When my husband and go there, we spend $60.00 (have LOBSTER TAILS UMMMMM need I say more) I can't say any more, it a place you'll never forget If you never go, you'll miss A Meal of your life time",LOBSTER TAILS,LOBSTER TAILS,1,headline
367174,"in an effort to increase turnover, the restaurant offers no desserts beyond the complimentary espresso cup filled with chocolate mousse.",desserts,desserts,1,headline
413294,"I've been to this restaurant more than a dozen times and when I'm craving for Pho, Lemon grass chicken or Beef Cube on rice, this is the place to go.",Pho,Pho,1,headline
282812,"Oh yes, and if you are a fan of Indian oldies film stars, there are plenty of portraits of Indian actors and actresses in classic black white that adorn the walls, some of which, I would love to know where they obtained.",portraits,portraits,1,headline
141280,"The food is spectacular, from the appitizers to the main course, and then of course the desserts, (WOW) you'll need no more.",food,food,1,headline
153567,My fish was delicious in an incredible curry sauce.,fish,fish,1,headline
421545,If you are in search of the most authentic NYC deli experience look no further than the famous and historic Katz's Deli down on the Lower East Side.,deli,deli,1,headline
